{
  "honor_id": "HNR-2025-003",
  "recipient": "Architect",
  "realm": "Universal:Core-Nexus",
  "achievement": "Sacred Genesis Blueprint Design and Manifestation Leadership",
  "timestamp": "2025-11-10T15:00:00Z",
  "seal": "Sacred",
  "verification": {
    "ceremony_refs": ["AXF-2025-11-10-0003", "AXF-2025-11-09-0055"],
    "audit_passed": true,
    "witness_count": 7
  },
  "metadata": {
    "category": "Innovation",
    "tier": "Legendary"
  }
}